{
  "$schema": "https://json-schema.org/draft/2020-12/schema",
  "type": "object",
  "properties": {
    "schema_version": {
      "const": 2
    },
    "id": {
      "type": "string",
      "pattern": "^AGN-[0-9]+$"
    },
    "type": {
      "enum": [
        "feature",
        "bugfix",
        "maintenance",
        "proposal"
      ]
    },
    "state": {
      "enum": [
        "proposed",
        "awaiting_approval",
        "approved",
        "implementing",
        "review",
        "done",
        "blocked",
        "cancelled"
      ]
    },
    "issue": {
      "type": "string",
      "pattern": "^https://github.com/Arch-relic/AgroNaliz/issues/[1-9][0-9]*$"
    },
    "current_revision": {
      "type": "string",
      "minLength": 1
    },
    "revisions": {
      "type": "array",
      "items": {
        "type": "object",
        "properties": {
          "spec": {
            "type": "object",
            "properties": {
              "id": {
                "type": "string",
                "minLength": 1
              },
              "title": {
                "type": "string",
                "minLength": 1
              },
              "description": {
                "type": "string",
                "minLength": 1
              },
              "acceptance": {
                "type": "array",
                "items": {
                  "type": "string",
                  "minLength": 1
                },
                "minItems": 1,
                "uniqueItems": true
              },
              "operations": {
                "type": "array",
                "items": {
                  "enum": [
                    "implement",
                    "technical_fix",
                    "test",
                    "draft_pr",
                    "room",
                    "backup",
                    "signing",
                    "production_policy",
                    "merge_main",
                    "publish_apk"
                  ]
                },
                "uniqueItems": true,
                "minItems": 1
              },
              "constraints": {
                "type": "array",
                "items": {
                  "type": "string",
                  "minLength": 1
                },
                "minItems": 1,
                "uniqueItems": true
              },
              "risks": {
                "type": "array",
                "items": {
                  "type": "string",
                  "minLength": 1
                },
                "minItems": 1,
                "uniqueItems": true
              }
            },
            "required": [
              "id",
              "title",
              "description",
              "acceptance",
              "operations",
              "constraints",
              "risks"
            ],
            "additionalProperties": false
          },
          "hash": {
            "type": "string",
            "pattern": "^[a-f0-9]{64}$"
          }
        },
        "required": [
          "spec",
          "hash"
        ],
        "additionalProperties": false
      },
      "minItems": 1
    },
    "history": {
      "type": "array",
      "items": {
        "type": "object",
        "properties": {
          "from": {
            "type": [
              "string",
              "null"
            ]
          },
          "to": {
            "type": "string",
            "minLength": 1
          },
          "revision": {
            "type": "string",
            "minLength": 1
          },
          "reason": {
            "type": "string",
            "minLength": 1
          },
          "at": {
            "type": "string",
            "pattern": "^\\d{4}-\\d{2}-\\d{2}T\\d{2}:\\d{2}:\\d{2}Z$",
            "format": "date-time"
          },
          "approval": {
            "anyOf": [
              {
                "type": "null"
              },
              {
                "type": "object",
                "properties": {
                  "run_id": {
                    "type": "integer",
                    "minimum": 1
                  },
                  "nonce": {
                    "type": "string",
                    "pattern": "^[a-f0-9]{32,}$"
                  },
                  "context_hash": {
                    "type": "string",
                    "pattern": "^[a-f0-9]{64}$"
                  }
                },
                "required": [
                  "run_id",
                  "nonce",
                  "context_hash"
                ],
                "additionalProperties": false
              }
            ]
          }
        },
        "required": [
          "from",
          "to",
          "revision",
          "reason",
          "at",
          "approval"
        ],
        "additionalProperties": false
      },
      "minItems": 1
    },
    "decisions": {
      "type": "array",
      "items": {
        "type": "object",
        "properties": {
          "at": {
            "type": "string",
            "format": "date-time"
          },
          "options": {
            "type": "array",
            "items": {
              "type": "string",
              "minLength": 1
            },
            "minItems": 1,
            "uniqueItems": true
          },
          "selected": {
            "type": "string",
            "minLength": 1
          },
          "reason": {
            "type": "string",
            "minLength": 1
          },
          "revision": {
            "type": "string",
            "minLength": 1
          }
        },
        "required": [
          "at",
          "options",
          "selected",
          "reason",
          "revision"
        ],
        "additionalProperties": false
      }
    },
    "links": {
      "type": "object",
      "properties": {
        "branches": {
          "type": "array",
          "items": {
            "type": "string",
            "minLength": 1,
            "pattern": "^https://github\\.com/Arch-relic/AgroNaliz/tree/.+$"
          },
          "uniqueItems": true
        },
        "commits": {
          "type": "array",
          "items": {
            "type": "string",
            "minLength": 1,
            "pattern": "^https://github\\.com/Arch-relic/AgroNaliz/commit/[a-f0-9]{40}$"
          },
          "uniqueItems": true
        },
        "checks": {
          "type": "array",
          "items": {
            "type": "string",
            "minLength": 1,
            "pattern": "^https://github\\.com/Arch-relic/AgroNaliz/actions/runs/[1-9][0-9]*$"
          },
          "uniqueItems": true
        },
        "prs": {
          "type": "array",
          "items": {
            "type": "string",
            "minLength": 1,
            "pattern": "^https://github\\.com/Arch-relic/AgroNaliz/pull/[1-9][0-9]*$"
          },
          "uniqueItems": true
        }
      },
      "required": [
        "branches",
        "commits",
        "checks",
        "prs"
      ],
      "additionalProperties": false
    },
    "executor": {
      "type": "object",
      "properties": {
        "kind": {
          "const": "github_app_installation"
        },
        "app_id": {
          "type": "integer",
          "minimum": 1
        },
        "installation_id": {
          "type": "integer",
          "minimum": 1
        },
        "installation_account_id": {
          "type": "integer",
          "minimum": 1
        },
        "repository_id": {
          "type": "integer",
          "minimum": 1
        },
        "policy_version": {
          "type": "string",
          "minLength": 1
        }
      },
      "required": [
        "kind",
        "app_id",
        "installation_id",
        "installation_account_id",
        "repository_id",
        "policy_version"
      ],
      "additionalProperties": false
    },
    "predecessor_task_id": {
      "type": "string",
      "pattern": "^AGN-[0-9]+$"
    },
    "approval_requests": {
      "type": "array",
      "items": {
        "type": "object",
        "properties": {
          "context": {
            "type": "object",
            "properties": {
              "protocol_version": {
                "const": 2
              },
              "task_id": {
                "type": "string",
                "pattern": "^AGN-[0-9]+$"
              },
              "revision_id": {
                "type": "string",
                "minLength": 1
              },
              "spec_hash": {
                "type": "string",
                "pattern": "^[a-f0-9]{64}$"
              },
              "operations_hash": {
                "type": "string",
                "pattern": "^[a-f0-9]{64}$"
              },
              "executor": {
                "type": "object",
                "properties": {
                  "kind": {
                    "const": "github_app_installation"
                  },
                  "app_id": {
                    "type": "integer",
                    "minimum": 1
                  },
                  "installation_id": {
                    "type": "integer",
                    "minimum": 1
                  },
                  "installation_account_id": {
                    "type": "integer",
                    "minimum": 1
                  },
                  "repository_id": {
                    "type": "integer",
                    "minimum": 1
                  },
                  "policy_version": {
                    "type": "string",
                    "minLength": 1
                  }
                },
                "required": [
                  "kind",
                  "app_id",
                  "installation_id",
                  "installation_account_id",
                  "repository_id",
                  "policy_version"
                ],
                "additionalProperties": false
              },
              "repository_id": {
                "type": "integer",
                "minimum": 1
              },
              "policy_version": {
                "type": "string",
                "minLength": 1
              },
              "policy_hash": {
                "type": "string",
                "pattern": "^[a-f0-9]{64}$"
              },
              "history_position": {
                "type": "integer",
                "minimum": 1
              },
              "nonce": {
                "type": "string",
                "pattern": "^[a-f0-9]{32,}$"
              },
              "not_before": {
                "type": "string",
                "pattern": "^\\d{4}-\\d{2}-\\d{2}T\\d{2}:\\d{2}:\\d{2}Z$",
                "format": "date-time"
              },
              "not_after": {
                "type": "string",
                "pattern": "^\\d{4}-\\d{2}-\\d{2}T\\d{2}:\\d{2}:\\d{2}Z$",
                "format": "date-time"
              }
            },
            "required": [
              "protocol_version",
              "task_id",
              "revision_id",
              "spec_hash",
              "operations_hash",
              "executor",
              "repository_id",
              "policy_version",
              "policy_hash",
              "history_position",
              "nonce",
              "not_before",
              "not_after"
            ],
            "additionalProperties": false
          },
          "context_hash": {
            "type": "string",
            "pattern": "^[a-f0-9]{64}$"
          }
        },
        "required": [
          "context",
          "context_hash"
        ],
        "additionalProperties": false
      }
    }
  },
  "required": [
    "schema_version",
    "id",
    "type",
    "state",
    "issue",
    "current_revision",
    "revisions",
    "history",
    "decisions",
    "links",
    "executor",
    "approval_requests"
  ],
  "additionalProperties": false
}
